{
  "id": "base:bo_haddad",
  "type": "npc",
  "name": "loc:npc.bo_haddad",
  "role": "staff_candidate",
  "age": 30,
  "first_appears_day": 3,
  "visit_weight": 1.14,
  "trust_arc": "warming",
  "tells": [
    "arrives ten minutes early"
  ],
  "notes": "loc:npc.bo_haddad.notes",
  "tags": [
    "staff_candidate"
  ]
}
