{
  "id": "base:dev_bhatt",
  "type": "npc",
  "name": "loc:npc.dev_bhatt",
  "role": "repeat_offender",
  "age": 48,
  "first_appears_day": 1,
  "visit_weight": 1.31,
  "trust_arc": "cooling",
  "tells": [
    "counts their change twice"
  ],
  "notes": "loc:npc.dev_bhatt.notes",
  "tags": [
    "repeat_offender"
  ]
}
